{
  "schemaVersion": "aoi-scenario/1",
  "id": "AOI-SIM-059",
  "title": "Offline retry after a timeout creates a duplicate memory",
  "experiment": "D",
  "source": {
    "aoi_commit": "048f78383a2ff423a8b3c1f0532c4514b387708f",
    "mirofish_commit": "7657031ac01184afe2cb220f5ee3545573b5e843",
    "simulation_id": "oasis-couple-13-D-1792915282",
    "observation_ids": [
      "obs-001",
      "obs-002"
    ],
    "provenance": "local_oasis",
    "seed_version": "seeds-v1"
  },
  "actors": [
    "p-iris",
    "p-oren"
  ],
  "preconditions": [
    "A saves a note while the connection is unreliable.",
    "The first request times out after the server may have committed.",
    "A retries the same draft."
  ],
  "actions": [
    {
      "op": "create_memory",
      "note": "A sends a note with a stable client id."
    },
    {
      "op": "lose_connection",
      "note": "The response is lost."
    },
    {
      "op": "retry_operation",
      "note": "A retries the same draft."
    },
    {
      "op": "refresh_space",
      "note": "A checks the archive."
    }
  ],
  "expected_behavior": [
    "The retry is idempotent for the same client id.",
    "The archive contains exactly one memory.",
    "The retry reports the saved state truthfully."
  ],
  "candidate_failure_modes": [
    "Two identical memories appear.",
    "The retry creates a second media reservation.",
    "The first success is reported as failed, so A keeps retrying."
  ],
  "relevant_source_files": [
    "packages/api/src/domains/moments.ts",
    "features/composer/send-pipeline.ts",
    "features/moments/moments-context.tsx"
  ],
  "existing_test_coverage": [],
  "confidence": "hypothesis",
  "execution_target": "integration",
  "status": "mapped",
  "claims": {
    "observed_code_behavior": [
      "Memory create is idempotent per (space_id, client_id) while the row is live.",
      "Update and delete compare the observed updatedAt; a stale write returns 409 without side effects.",
      "Authorship and authorName are computed per viewer, not stored as a snapshot."
    ],
    "documented_requirement": [
      "The retry is idempotent for the same client id.",
      "The archive contains exactly one memory.",
      "The retry reports the saved state truthfully."
    ],
    "hypothetical_user_behavior": [
      "A fictional participant (Iris Vale) said: \"We are auditing Aoi for things that do not need to exist. Walk through the offline and account-lifecycle paths you actually used: the account indicator, pending saves, retry, backgrounding, switching accounts, session recovery, and every status line or control around them. For each one, ask out loud: \"Why does this even exist?\" Then say what would break if it were removed, and what it cost you. Name the three most useless things and the one thing you would keep. Do not propose a redesign; remove.\"",
      "A fictional participant (Iris Vale) said: \"Did it out loud, on the account-lifecycle path only. Verdict:\n\n1) The account indicator. Pure decoration — it restates in a second type size what the screen already says, and that size isn't in the scale. Remove it and nothing breaks. Cost: my eye goes to the corner on every account switch, for zero new information.\n\n2) The retry status line above pending saves. The state is already legible from the item's own typography and position. Two sources of truth for one fact. Kill the line, keep the item.\n\n3) The session-recovery modal. It interrupts me to announce something that has already resolved itself. Cost: a dialog I dismiss without reading, which trains me to dismiss dialogs. That one is a net negative, not just neutral.\n\nKeep: the pending-save item state. It's the only place in the flow where the interface teaches itself — offline is explained by the object, not by a banner.\n\nAlso, while I'm here: 12px status text at roughly 4.5:1 on a tinted card is doing neither job. Pick one — quiet, or readable.\"",
      "Iris Vale assumes: the interface should teach itself",
      "Iris Vale assumes: empty states should be designed",
      "Oren Pike assumes: a saved item survives relaunch",
      "Oren Pike assumes: an error is not a dead end"
    ],
    "potential_defect": [
      "Hypothesis, not reproduced: Two identical memories appear.",
      "Hypothesis, not reproduced: The retry creates a second media reservation.",
      "Hypothesis, not reproduced: The first success is reported as failed, so A keeps retrying."
    ],
    "reproduced_defect": []
  },
  "coverage": {
    "level": "partial",
    "evidence": [],
    "notes": "Related assertions or operations exist, but no single test block exercises the full scenario and proves the expected behavior."
  },
  "safety": {
    "synthetic_only": true,
    "contains_secrets": false,
    "production_data": false,
    "arbitrary_code": false
  }
}
